<!DOCTYPE Booking [
    <!ELEMENT Booking (BookingEntry+)>
    <!ELEMENT BookingEntry (userID, carID, startTime, endTime, cost, status)>
    <!ATTLIST BookingEntry bookingID CDATA #REQUIRED>

    <!ELEMENT userID (#PCDATA)>
    <!ELEMENT carID (#PCDATA)>
    <!ELEMENT startTime (#PCDATA)>
    <!ELEMENT endTime (#PCDATA)>
    <!ELEMENT cost (#PCDATA)>
    <!ELEMENT status (#PCDATA)>
]>

<Booking>
    <BookingEntry bookingID="001">
        <bookingID>001</bookingID>
        <userID>USER123</userID>
        <carID>CAR789</carID>
        <startTime>2024-11-20T10:00:00</startTime>
        <endTime>2024-11-20T15:00:00</endTime>
        <cost>150.00</cost>
        <status>Confirmed</status>
    </BookingEntry>

    <BookingEntry bookingID="002">
        <bookingID>002</bookingID>
        <userID>USER456</userID>
        <carID>CAR456</carID>
        <startTime>2024-12-01T09:00:00</startTime>
        <endTime>2024-12-01T13:00:00</endTime>
        <cost>200.00</cost>
        <status>Pending</status>
    </BookingEntry>

    <BookingEntry bookingID="003">
        <bookingID>003</bookingID>
        <userID>USER789</userID>
        <carID>CAR123</carID>
        <startTime>2024-12-05T14:30:00</startTime>
        <endTime>2024-12-05T18:30:00</endTime>
        <cost>175.50</cost>
        <status>Cancelled</status>
    </BookingEntry>

    <BookingEntry bookingID="004">
        <bookingID>004</bookingID>
        <userID>USER321</userID>
        <carID>CAR654</carID>
        <startTime>2024-11-30T08:00:00</startTime>
        <endTime>2024-11-30T12:00:00</endTime>
        <cost>120.00</cost>
        <status>Completed</status>
    </BookingEntry>

    <BookingEntry bookingID="005">
        <bookingID>005</bookingID>
        <userID>USER234</userID>
        <carID>CAR987</carID>
        <startTime>2024-11-29T16:00:00</startTime>
        <endTime>2024-11-29T20:00:00</endTime>
        <cost>250.75</cost>
        <status>Confirmed</status>
    </BookingEntry>
</Booking>


